{
    "id": "SAKE",
    "production_type": "purchasable",
    "type": "spirit",
    "unit": "gram",
    "sub_ingredients": ["RICE", "WATER", "RICE_KOJI", "YEAST"],
    "conversions": [
        {
            "base_unit": "mL",
            "multiplier": 0.99,
            "unit": "grams"
        }
    ]
}

